{
  "$schema": "https://json-schema.org/draft/2020-12/schema",
  "$id": "enterprise_risk_card.v1",
  "type": "object",
  "required": ["risk_card_id", "task_id", "attribution", "license", "privacy", "biosafety_or_medical", "claim_boundary", "release_status"],
  "properties": {
    "risk_card_id": {"type": "string", "pattern": "^RISK-"},
    "task_id": {"type": "string"},
    "attribution": {"type": "object"},
    "license": {"type": "object"},
    "privacy": {"type": "object"},
    "biosafety_or_medical": {"type": "object"},
    "claim_boundary": {"type": "array", "minItems": 1},
    "release_status": {"enum": ["REVIEW_REQUIRED", "PRIVATE_INTERNAL_ONLY", "READY_FOR_HARBOR"]}
  }
}
